Exam Name,Exam Post,Vacancy,Application Start Date,Application End Date
Broadcasting Engineering Consultants India Limited (BECIL),Programme Coordinator Contract Basis Recruitment 2018,300,28/04/2018,21/05/2018
"Naval Dockyard, Mumbai (Ministry of Defence)",Navy Group C Fire Man Recruitment 2018,95,30/04/2018,19/05/2018
Madhya Pradesh Public Service Commission (MPPSC),State Services Examination | Forest Exam Recruitment 2018,308,18/12/2017,8/1/2018
Chhattisgarh Public Service Commission (CGPCS),State Service Prelim Exam Recruitment 2017,303,9/12/2017,7/1/2018
Central Board of Secondary Education (CBSE),UGC National Eligibility Test / Lecturer / JRF Examination July 2018,,6/3/2018,12/4/2018
Rajasthan Public Service Commission (RPSC),Sub Inspector | Platoon Commander Recruitment Online Form 2018,330,25/04/2018,24/05/2018
MP Madhya Pradesh High Court Online Form 2018,"Cook, Sweeper, Gardener, Peon Recruitment 2018",40,23/04/2018,22/05/2018
Rajasthan Education Department (RED),Primary / Upper Primary School Grade III Teacher Recruitment 2018,26000,14/04/2018,30/04/2018
Rajasthan Public Service Commission (RPSC),Senior Grade II Teacher (TGT) TSP / Non TSP Area Recruitment 2017-18,707,17/04/2018,12/5/2018
Rajasthan Public Service Commission (RPSC),School Lecturer Recruitment 2017-18,134,20/04/2018,9/5/2018
Rajasthan Public Service Commission (RPSC),Physiotherapist Recruitment 2018 ,30,17/04/2018,1/5/2018
Rajasthan Subordinate and Ministerial Service Selection Board (RSMSSB),Various Post in Various Department Recruitment 2018,2512,22/03/2018,20/04/2018
State Bank of India (SBI),Probationary Officer (PO) Recruitment 2018,2000,21/04/2018,13/05/2018
National Thermal Power Corporation Limited (NTPC),Diploma Trainee Recruitment 2018,362,18/04/2018,9/5/2018
<title>Bihar Police ASI Steno Mains Result 2019,<title>Bihar Police ASI Steno Mains Result 2019,174,18/04/2018,24/05/2018
Haryana Staff Selection Commission (HSSC),Haryana Police Department Constable ans SI Recruitment 2018,7110,28/04/2018,28/05/2018
Rajasthan Public Service Commission (RPSC),Assistant Agriculture Research Officer (AARO) Recruitment 2018,52,23/05/2018,13/06/2018
Madhya Pradesh High Court (MPHC),District Judge Entry Level (MPHJS) Recruitment 2018,28,13/04/2018,30/04/2018
Madhya Pradesh Public Service Commission (MPPSC),Assistant Professor Recruitment 2017,2968,15/01/2018,10/05/2018(Extended)
Kendirya Vidyalaya Sangathan (KVS),Departmental Competitive Exam Through LDCE 2018,5193,11/4/2018,25/04/2018
"Department of Medical, Health & Family Welfare, Rajasthan",Male / Female Staff Nurse Direct Recruitment 2018,4514,12/4/2018,12/5/2018
Rajasthan Public Service Commission (RPSC),Various Advertisement No and Various Post Recruitment 2018,,,
Indian Space Research Organization (ISRO),Junior Personal Assistant | Stenographer Recruitment 2018,171,10/4/2018,30/04/2018
Madhya Pradesh Professional Examination Board (MPPEB),Mahila Swastha Karyakarta Prashikshan (ANM) Test 2018,740,9/4/2018,23/04/2018
Rajasthan Public Service Commission (RPSC),Protection Officer Recruitment 2018,20,5/4/2018,19/05/2018
Rajasthan Public Service Commission (RPSC),Head Master Teacher Recruitment 2018 in Secondary Schoo,1200,9/4/2018,8/5/2018
Indian Bank (IB),Specialist Officer SO Recruitment 2018,145,10/4/2018,2/5/2018
Haryana Staff Selection Commission (HSSC),Fire Operator Cum Driver Recruitment 2018,1646,6/4/2018,6/5/2018
Madhya Pradesh Saugor Cantonment Board (MPSCB),Various Post Recruitment 2018,31,31/03/2018,30/04/2018
Rajasthan Public Service Commission (RPSC),State Service Exam (RAS/RTS) Recruitment 2018,980,12/4/2018,11/5/2018
Madhya Pradesh Professional Examination Board (MPPEB),Marketing Federation Exam Recruitment 2018,184,26/03/2018,9/4/2018
Madhya Pradesh Professional Examination Board (MP PEB),"Group 2 Sub Group 4 (AG I, III, Other Post) Recruitment 2018",157,24/03/2018,7/4/2018
Supreme Court of India,SCI Junior Court Attendant | Chamber Attendant Recruitment 2018,78,21/03/2018,15/04/2018
Bureau of Indian Standards (BIS),Scientist Grade B (Engineering) Recruitment 2018,109,16/03/2018,2/4/2018
State Bank of India SBI,Various Specialist Officer Post Recruitment 2018,119,20/03/2018,7/4/2018
Bhabha Atomic Research Center (BARC),Stenographer | Junior Purchase Assistant Recruitment 2018,11,17/03/2018,16/04/2018
Bihar State Power Holding Company Limited,BSPHCL Assistant Engineer AE Recruitment 2018,240,16/03/2018,31/03/2018
National Bank for Agriculture and Rural Development,NABARD Various Group A (Assistant Manager) Recruitment 2018,92,13/03/2018,2/4/2018
Uttar Pradesh Subordinate Service Selection Commission (UPSSSC),Exercise Trainer | Development Team Officer Recruitment 2018,694,,
Council of Scientific and Industrial Research (CSIR),Joint CSR UGC Test for JRF & NET June 2018,,5/3/2018,26/03/2018
Jharkhand Public Service Commission (JPSC),Assistant Public Prosecutor (APO) Recruitment 2018,143,23/02/2018,8/4/2018
Staff Selection Commission (SSC),Sub Inspector CPO SI Recruitment 2018,1223,3/3/2018,13/04/2018 upto 0500 Pm Only
"Rajasthan Subordinate and Ministerial Services Selection Board, Jaipur",RSMSSB Informatics Assistant (Suchna Sahayak) Recruitment 2018,1302,8/3/2018,6/4/2018
Jharkhand Staff Selection Commission (JSSC),Jharkhand State Field Clerk Limited (FCLCE) Recruitment 2018,265,5/3/2018,16/04/2018
Madhya Pradesh Professional Examination Board (MPPEB),Kanishath Appoorti Officer & Other Various Post Recruitment 2018,219,27/02/2018,13/03/2018
"Rajasthan Subordinate and Ministerial Services Selection Board, Jaipur",RSMSSB Computer Direct Recruitment 2018,400,26/02/2018,27/03/2018
National Building Construction Corporation Limited (NBCC India),Junior Engineer and Other Post Recruitment 2018,33,24/02/2018,25/03/2018 upto 0600 PM Only
LMRC Lucknow Metro Rail Corporation Ltd,Non Executive Various Post Recruitment 2018,358,23/02/2018,27/03/2018
LMRC Lucknow Metro Rail Corporation Ltd,Assistant Manager Executive Post Recruitment 2018,28,23/02/2018,27/03/2018
Railway Coach Factory (RCF),Trade Apprentice Recruitment 2018,195,17/02/2018,19/03/2018 upto 0500 PM Only
Central Selection Board of Constable (CSBC),Bihar Police Constable Driver Recruitment 2018,1669,21/02/2018,23/03/2018
Uttar Pradesh Power Corporation Limited (UPPCL),Various Post Recruitment 2018,2842,21/02/2018,13/03/2018
Madhya Pradesh Professional Examination Board (MPPEB) ,MP Police Constable Recruitment 2017,14088,8/6/2017,11/7/2017
Indian Oil Corporation Limited (IOCL),Northern Region Various Apprentice Post Recruitment 2018,225,10/2/2018,25/02/2018
Agriculture Scientist Recruitment Board (ASRB),Agriculture Research Service ARS Com. with National Eligibility Test NET 2018,195,6/2/2018,2/3/2018
Combined Industrial Security Force (CISF),Constable Driver Recruitment 2018,447,19/02/2018,19/02/2018
Indian Army Rally | Join Indian Army,Uttar Pradesh UP Various Post Recruitment 2018,,10/2/2018,26/03/2018
"Uttar Pradesh Basic Education Board, Allahabad",Inter District Teacher Transfer Online Application 2018,,16/01/2018,15/02/2018 Till 0500 PM
Rajasthan High Court (RHC),Class IV Group D Recruitment in TSP and Non TSP Area 2018,2309,12/2/2018,13/03/2018
Indo Tibetan Border Police Force (ITBP),Constable Driver Recruitment 2018,134,14/02/2018,15/03/2018
IDBI Bank Limited,IDBI Executive Post Recruitment 2018,760,6/2/2018,28/02/2018
<title>Allahabad High Court Class IV 91 Post Recruitment 2018,<title>Allahabad High Court Class IV 91 Post Recruitment 2018,91,6/2/2018,11/05/2018 (Extended)
Supreme Court of India (SCI),Court Assistant Recruitment 2018,,1/2/2018,28/02/2018
Indian Coast Guard,Navik in (Domestic Branch) Recruitment 2018,,10/2/2018,16/02/2018 upto 0500 PM Only
Indian Space Research Organization (ISRO),Scientist / Engineer Recruitment 2018,106,31/01/2018,20/02/2018
Railway Recruitment Cell (RRC),East Central Railway (ECR) Trade Apprentice Recruitment 2018,1898,30/01/2018,28/02/2018
Reserve Bank of India (RBI),Special Drive Assistant Recruitment for PWD Candidates 2018,27,30/01/2018,19/02/2018
Uttar Pradesh Public Service Commission (UPPSC),Combined State Upper Subordinate Service Exam PCS Recruitment 2017,251,9/5/2017,6/6/2017
"Social Welfare Department, Uttar Pradesh",Pre Matric | Post Matric | Dashmottar Scholarship 2017,,Last Date for Apply Online,Courses Available
"Chhattisgarh Police Head Quarter, Raipur",CG Police Constable in Various Trade Recruitment 2018,1786,26/01/2018,15/02/2018
Delhi Metro Rail Corporation Limited (DMRC),Regular / Special Various Post Recruitment 2018,1985,27/01/2018,12/03/2018 (Extended)
State Bank of India (SBI),Junior Associates Clerk in Support and Sales Recruitment 2018,8301,20/01/2018,10/2/2018
The Indian Navy (Join Indian Navy),Sailor Entry 10+2 SSR | AA Recruitment 2018,,27/11/2017,13/12/2017
Union Public Service Commission (UPSC),National Defence Academy and Naval Academy Exam NDA I 2018,415,15/01/2018,05/02/2018 Upto 0600 PM Only
Uttar Pradesh Police Recruitment and Promotion Board (UP PRPB),Male / Female Constable Recruitment 2018,41520,22/01/2018,22/02/2018
Department of Science & Technology (MP Government),Computer Proficiency Certification Test (MP CPCT 2018),,7/1/2018,28/01/2018
Canara Bank Recruitment 2018,"Probationary Officers in JMG Scale I, PGDBF",450,9/1/2018,31/01/2018
The Indian Navy (Nausena Bharti),Engineer as a Short Service Commission Officer Recruitment 2018,108,5/1/2018,25/01/2018
Join Indian Coast Guard (Ministry of Defence),Yantrik 02/2018 Batch Recruitment 2018,,12/1/2018,19/01/2018 upto 0500 PM Only
Uttar Pradesh Public Service Commission (UPPSC),Various Post Direct Recruitment 2018,,30/12/2017,25/01/2018
Employment Department Uttar Pradesh,UP Rojgar Mela Online Registration 2018,,3/1/2018,15/02/2018
"Chhattisgarh Police Department, New Raipur",CG Police Constable in Various Trade Recruitment 2018,2258,3/1/2018,4/2/2018
Export Credit Guarantee Corporation of India (ECGC),Probationary Officer PO Recruitment 2018,32,1/1/2018,15/01/2018
Uttar Pradesh Public Service Commission (UPPSC),Review Officer | Assistant Review Officer (RO / ARO) Recruitment 2017,460,30/12/2017,25/01/2018
Syndicate Bank | Manipal University | Nitte University,Probationary Officer PO in JMG Scale I Recruitment 2018,500,2/1/2018,17/01/2018
Examination Regulatory Authority UP Allahabad,CT Nursery | NTT | D.Ped 2015-2016 Online Registration 2018,,27/12/2017,25/01/2018 Upto 0600 PM Only
Chhattisgarh Public Service Commission (CGPSC),State Forest Examination Recruitment 2018,59,8/1/2018,6/2/2018
Indo Tibetan Boarder Police Force (ITBP),Constable | Head Constable in Motor Mechanic Recruitment 2018,241,2/1/2018,31/01/2018
Bihar Public Service Commission (BPSC),"60, 61 and 62 Common Combined Preliminary Exam 2016",642,27/09/2016,31/10/2016
Delhi Subordinate Services Selection Board (DSSSB),TGT / PGT Teacher Recruitment 2018,9232,5/1/2018,31/01/2018
Join Indian Coast Guard,10+2 Navik GD Recruitment 2018,,24/12/2017,2/1/2018
High Court of Judicature at Allahabad,Lift Operator & Mechanic Recruitment 2018,38,21/12/2017,8/1/2018
Kendriya Vidyalaya Sangathan (KVS),Non Teaching Various Post Recruitment 2018,1017,21/12/2017,11/1/2018
South Indian Bank (SIB),Probationary Clerk Recruitment 2017,468,20/12/2017,30/12/2017
Army Ordinance Corps,Various Post Group C Recruitment 2017,818,17-Dec,26/12/2017
Madhya Pradesh Professional Examination Board (MPPEB),Sub Group 1 Combined Recruitment 2018,249,14/12/2017,28/12/2017
Career Indian Air Force Recruitment 2018,Airforce Common Admission Online Test (AFCAT 01/2018),,16/12/2017,23/01/2018
MP Power Transmission Company Ltd (MPTRANSCO),Line Attendant Recruitment (Contract) 2017,70,15/12/2017,14/01/2018
Railway Recruitment Cell (RRC Delhi),Northern Region NR Trade Apprentice Online Form 2017,3162,28/12/2017,27/01/2018 upto 0500 PM
Uttar Pradesh Power Corporation Ltd (UPPCL),APS | ARO (Samiksha Adhikari) Recruitment 2017,80,14/12/2017,29/12/2017
Uttar Pradesh Power Corporation Limited (UPPCL),Office Assistant | Stenographer Recruitment 2017,2523,14/12/2017,29/12/2017
Uttar Pradesh Power Corporation Ltd (UPPCL),Office Assistant Account Grade III Recruitment 2017,30,14/12/2017,29/12/2017
Jharkhand Staff Selection Commission (JSSC) ,Post Graduate Teacher PGT Recruitment 2017,3080,11/12/2017,10/1/2018
"South Eastern Railway (SER), Kolkata",Various Trade Apprentice Recruitment 2017,1785,4/12/2017,02/01/2018 upto 0500 PM Only
Delhi Police (DP),Multi Tasking Staff MTS Recruitment 2017,707,17/12/2017,16/01/2018
Central Industrial Security Force (CISF),Constable / Fire (Male) Recruitment 2017,332,11/12/2017,11/1/2018
Indian Air Force (Bharitya Vayu Sena),X Group | Y Group Airmen Recruitment Online Form 2018,,15/12/2017,17/01/2018
Join Indian Navy (Nausena Bharti),"Stewards, Chefs And Hygienists for MR October 2018 Batch Recruitment",,4/12/2017,20/12/2017
Assam Rifles Rally Recruitment 2017,Various Tradesman Post Online Form,754,17-Nov,20/12/2017
